{
  "$schema": "https://json-schema.org/draft/2020-12/schema",
  "$id": "https://github.com/tt-a1i/archify/schemas/sequence.schema.json",
  "title": "Archify Sequence Diagram",
  "type": "object",
  "additionalProperties": false,
  "required": [
    "schema_version",
    "diagram_type",
    "meta",
    "participants",
    "messages"
  ],
  "properties": {
    "schema_version": {
      "const": 1
    },
    "diagram_type": {
      "const": "sequence"
    },
    "meta": {
      "type": "object",
      "additionalProperties": false,
      "required": [
        "title",
        "output"
      ],
      "properties": {
        "title": {
          "type": "string",
          "minLength": 1
        },
        "locale": {
          "$ref": "common.schema.json#/$defs/locale"
        },
        "translations": {
          "$ref": "common.schema.json#/$defs/translations"
        },
        "subtitle": {
          "type": "string"
        },
        "output": {
          "$ref": "common.schema.json#/$defs/portableOutputPath"
        },
        "animation": {
          "$ref": "common.schema.json#/$defs/animation"
        },
        "visual_preset": {
          "$ref": "common.schema.json#/$defs/visualPreset"
        },
        "quality_profile": {
          "$ref": "common.schema.json#/$defs/qualityProfile"
        },
        "column_fit": {
          "description": "Horizontal participant layout. Defaults to spread whether or not meta.viewBox is supplied. Explicit fixed preserves the historical 86px boxes and 108px column gap. Use spread when a wide viewBox would leave unused horizontal space or meaningful participant labels do not fit the fixed boxes; spread derives box width and column distance from the viewBox with at least a 16px gap between participant cards without changing participant order or message semantics.",
          "enum": [
            "fixed",
            "spread"
          ]
        },
        "repository": {
          "$ref": "common.schema.json#/$defs/repository"
        },
        "views": {
          "$ref": "common.schema.json#/$defs/guidedViews"
        },
        "legend": {
          "type": "object",
          "additionalProperties": false,
          "properties": {
            "mode": {
              "$ref": "common.schema.json#/$defs/legendMode"
            },
            "entries": {
              "type": "object",
              "additionalProperties": false,
              "properties": {
                "default": {
                  "$ref": "common.schema.json#/$defs/legendEntry"
                },
                "emphasis": {
                  "$ref": "common.schema.json#/$defs/legendEntry"
                },
                "security": {
                  "$ref": "common.schema.json#/$defs/legendEntry"
                },
                "dashed": {
                  "$ref": "common.schema.json#/$defs/legendEntry"
                },
                "return": {
                  "$ref": "common.schema.json#/$defs/legendEntry"
                }
              }
            }
          }
        },
        "viewBox": {
          "type": "array",
          "prefixItems": [
            {
              "type": "number",
              "minimum": 480
            },
            {
              "type": "number",
              "minimum": 480
            }
          ],
          "items": false,
          "minItems": 2,
          "maxItems": 2
        }
      }
    },
    "participants": {
      "type": "array",
      "minItems": 2,
      "items": {
        "type": "object",
        "additionalProperties": false,
        "required": [
          "id",
          "type",
          "label"
        ],
        "properties": {
          "id": {
            "$ref": "common.schema.json#/$defs/id"
          },
          "type": {
            "$ref": "common.schema.json#/$defs/componentType"
          },
          "label": {
            "type": "string",
            "minLength": 1
          },
          "sublabel": {
            "type": "string"
          },
          "icon": {
            "$ref": "common.schema.json#/$defs/nodeIcon"
          },
          "brand": {
            "$ref": "common.schema.json#/$defs/brandMark"
          },
          "sources": {
            "$ref": "common.schema.json#/$defs/sourceReferences"
          }
        }
      }
    },
    "groups": {
      "description": "Blocks that gather the participants of one app, service, firmware or hardware part. Members must be adjacent participants; blocks must follow the layer order ui, app, service, firmware, hardware from left to right.",
      "type": "array",
      "items": {
        "type": "object",
        "additionalProperties": false,
        "required": [
          "id",
          "label",
          "layer",
          "participants"
        ],
        "properties": {
          "id": {
            "$ref": "common.schema.json#/$defs/id"
          },
          "label": {
            "type": "string",
            "minLength": 1
          },
          "layer": {
            "enum": [
              "ui",
              "app",
              "service",
              "firmware",
              "hardware",
              "external"
            ]
          },
          "participants": {
            "type": "array",
            "minItems": 1,
            "items": {
              "$ref": "common.schema.json#/$defs/id"
            }
          }
        }
      }
    },
    "segments": {
      "type": "array",
      "items": {
        "type": "object",
        "additionalProperties": false,
        "required": [
          "from",
          "to",
          "label"
        ],
        "properties": {
          "from": {
            "type": "number"
          },
          "to": {
            "type": "number"
          },
          "label": {
            "type": "string",
            "minLength": 1
          }
        }
      }
    },
    "messages": {
      "type": "array",
      "minItems": 1,
      "items": {
        "type": "object",
        "additionalProperties": false,
        "required": [
          "from",
          "to",
          "y",
          "label"
        ],
        "properties": {
          "id": {
            "$ref": "common.schema.json#/$defs/id"
          },
          "from": {
            "$ref": "common.schema.json#/$defs/id"
          },
          "to": {
            "$ref": "common.schema.json#/$defs/id"
          },
          "y": {
            "type": "number",
            "minimum": 160
          },
          "label": {
            "type": "string",
            "minLength": 1
          },
          "variant": {
            "enum": [
              "default",
              "emphasis",
              "security",
              "dashed",
              "return"
            ]
          },
          "note": {
            "type": "string"
          },
          "details": {
            "description": "Detailed steps inside a block that run right after this step. Hidden until the reader opens the step. A detail step may call its own participant.",
            "type": "array",
            "minItems": 1,
            "items": {
              "type": "object",
              "additionalProperties": false,
              "required": [
                "from",
                "to",
                "label"
              ],
              "properties": {
                "from": {
                  "$ref": "common.schema.json#/$defs/id"
                },
                "to": {
                  "$ref": "common.schema.json#/$defs/id"
                },
                "label": {
                  "type": "string",
                  "minLength": 1
                },
                "variant": {
                  "enum": [
                    "default",
                    "emphasis",
                    "security",
                    "dashed",
                    "return"
                  ]
                },
                "note": {
                  "type": "string"
                }
              }
            }
          }
        }
      }
    },
    "activations": {
      "type": "array",
      "items": {
        "type": "object",
        "additionalProperties": false,
        "required": [
          "participant",
          "from",
          "to"
        ],
        "properties": {
          "participant": {
            "$ref": "common.schema.json#/$defs/id"
          },
          "from": {
            "type": "number"
          },
          "to": {
            "type": "number"
          },
          "type": {
            "$ref": "common.schema.json#/$defs/componentType"
          }
        }
      }
    },
    "cards": {
      "$ref": "common.schema.json#/$defs/cards"
    }
  }
}
